{
  "$schema": "https://geocourse.org/schema/0.1/geocourse.schema.json",
  "type": "Course",
  "format": "0.1",
  "id": "test-bend-at-start",
  "version": 1,
  "name": "Bend at the start",
  "description": "Test course: starts on a 30 m right bend, measured with the window clamped at the start.",
  "length": 147.1238898038469,
  "closed": false,
  "licence": "CC0-1.0",
  "geometry": {
    "frame": "local",
    "step": 1,
    "scale": 0.01,
    "positions": [0, 0, 100, -2, 200, -7, 300, -15, 399, -27, 498, -42, 596, -60, 694, -81, 791, -106, 887, -134, 982, -165, 1076, -199, 1168, -237, 1260, -277, 1350, -321, 1438, -367, 1525, -417, 1610, -469, 1694, -524, 1776, -582, 1855, -642, 1933, -705, 2008, -771, 2081, -839, 2152, -910, 2221, -983, 2287, -1058, 2350, -1135, 2411, -1215, 2469, -1296, 2524, -1379, 2577, -1464, 2627, -1551, 2674, -1639, 2717, -1729, 2758, -1820, 2796, -1913, 2831, -2007, 2862, -2102, 2891, -2198, 2916, -2294, 2938, -2392, 2956, -2490, 2972, -2589, 2984, -2688, 2992, -2788, 2998, -2888, 3000, -2988, 3000, -3088, 3000, -3188, 3000, -3288, 3000, -3388, 3000, -3488, 3000, -3588, 3000, -3688, 3000, -3788, 3000, -3888, 3000, -3988, 3000, -4088, 3000, -4188, 3000, -4288, 3000, -4388, 3000, -4488, 3000, -4588, 3000, -4688, 3000, -4788, 3000, -4888, 3000, -4988, 3000, -5088, 3000, -5188, 3000, -5288, 3000, -5388, 3000, -5488, 3000, -5588, 3000, -5688, 3000, -5788, 3000, -5888, 3000, -5988, 3000, -6088, 3000, -6188, 3000, -6288, 3000, -6388, 3000, -6488, 3000, -6588, 3000, -6688, 3000, -6788, 3000, -6888, 3000, -6988, 3000, -7088, 3000, -7188, 3000, -7288, 3000, -7388, 3000, -7488, 3000, -7588, 3000, -7688, 3000, -7788, 3000, -7888, 3000, -7988, 3000, -8088, 3000, -8188, 3000, -8288, 3000, -8388, 3000, -8488, 3000, -8588, 3000, -8688, 3000, -8788, 3000, -8888, 3000, -8988, 3000, -9088, 3000, -9188, 3000, -9288, 3000, -9388, 3000, -9488, 3000, -9588, 3000, -9688, 3000, -9788, 3000, -9888, 3000, -9988, 3000, -10088, 3000, -10188, 3000, -10288, 3000, -10388, 3000, -10488, 3000, -10588, 3000, -10688, 3000, -10788, 3000, -10888, 3000, -10988, 3000, -11088, 3000, -11188, 3000, -11288, 3000, -11388, 3000, -11488, 3000, -11588, 3000, -11688, 3000, -11788, 3000, -11888, 3000, -11988, 3000, -12088, 3000, -12188, 3000, -12288, 3000, -12388, 3000, -12488, 3000, -12588, 3000, -12688, 3000, -12788, 3000, -12888, 3000, -12988, 3000, -13000]
  },
  "profile": {
    "step": 10,
    "elevation": {
      "scale": 0.1,
      "values": [500, 500, 500, 500, 500, 500, 500, 500, 500, 500, 500, 500, 500, 500, 500, 500]
    },
    "bendRadiusLimit": 400
  },
  "ranges": [
    {
      "type": "marker",
      "from": 0,
      "to": 0,
      "properties": {
        "kind": "start"
      }
    },
    {
      "type": "road",
      "from": 0,
      "to": 147.1238898038469,
      "properties": {
        "highway": "cycleway",
        "width": 3,
        "widthSource": "design"
      }
    },
    {
      "type": "surface",
      "from": 0,
      "to": 147.1238898038469,
      "properties": {
        "crr": 0.004,
        "grip": 0.8,
        "surface": "asphalt"
      }
    },
    {
      "type": "bend",
      "from": 0,
      "to": 57.12,
      "properties": {
        "radius": 30,
        "direction": "right",
        "apex": 23.56
      }
    },
    {
      "type": "marker",
      "from": 147.1238898038469,
      "to": 147.1238898038469,
      "properties": {
        "kind": "finish"
      }
    }
  ]
}
